{
  "version": "0",
  "id": "f71bbbbb-5b36-40c2-f7dc-804ca6270cd6",
  "detail-type": "AnalysisRunUpdate",
  "source": "<some glue service>",
  "account": "123456789012",
  "time": "2024-05-01T09:25:44Z",
  "region": "ap-southeast-2",
  "resources": [],
  "detail": {
    "analysisRunName": "TestAnalysisRunName_1",
    "analysis": {
      "orcabusId": "ana.01K3FSK7ZRED7387G9374NGDBA",
      "name": "WGS",
      "version": "1.0"
    },
    "libraries": [
      {
        "libraryId": "L000001",
        "orcabusId": "lib.123456789ABCDEFGHJKMNPQRST"
      },
      {
        "libraryId": "L000002",
        "orcabusId": "lib.223456789ABCDEFGHJKMNPQRST"
      }
    ],
    "status": "DRAFT"
  }
}
