{
  "version": "0",
  "id": "f71bbbbb-5b36-40c2-f7dc-804ca6270cd6",
  "detail-type": "AnalysisRunUpdate",
  "source": "<some glue service>",
  "account": "123456789012",
  "time": "2024-05-01T09:25:44Z",
  "region": "ap-southeast-2",
  "resources": [],
  "detail": {
    "analysisRunName": "TestAnalysisRunName_1",
    "analysis": {
      "orcabusId": "ana.01K3FSK7ZRED738GT4KM7A2E6F",
      "name": "WGS",
      "version": "2.0"
    },
    "libraries": [
      {
        "libraryId": "L000001",
        "orcabusId": "lib.123456789ABCDEFGHJKMNPQRST",
        "readsets": [
          {
            "orcabusId": "fqr.READSET123456789ABCDEFGHJK",
            "rgid": "AAGCAGTC+ACGCCAAC.1.990101_A00130_0999_BH7TVMDSX7"
          },
          {
            "orcabusId": "fqr.READSET234567891ABCDEFGHJK",
            "rgid": "AAGCAGTC+ACGCCAAC.2.990101_A00130_0999_BH7TVMDSX7"
          }
        ]
      },
      {
        "libraryId": "L000002",
        "orcabusId": "lib.223456789ABCDEFGHJKMNPQRST",
        "readsets": [
          {
            "orcabusId": "fqr.READSET345678912ABCDEFGHJK",
            "rgid": "CCGCAGTC+TCGCCAAC.1.990101_A00130_0999_BH7TVMDSX7"
          },
          {
            "orcabusId": "fqr.READSET456789123ABCDEFGHJK",
            "rgid": "CCGCAGTC+TCGCCAAC.2.990101_A00130_0999_BH7TVMDSX7"
          }
        ]
      }
    ],
    "computeEnv": "research",
    "storageEnv": "research",
    "status": "DRAFT"
  }
}
